{
  "market": "market-04",
  "contractVersion": 3,
  "contractStatus": "draft",
  "resolutionSource": false,
  "title": "Corrections change the system",
  "outcomes": [
    "YES",
    "NO",
    "OTHER"
  ],
  "evidenceCutoff": "2027-12-31",
  "windowCloses": "2028-02-29",
  "outcome": "OTHER",
  "reason": "no-qualifying-attempt",
  "attempts": []
}
