{
  "market": "market-03",
  "contractVersion": 1,
  "contractStatus": "frozen",
  "resolutionSource": true,
  "title": "Who or what rules apply to",
  "outcomes": [
    "YES",
    "NO",
    "OTHER"
  ],
  "evidenceCutoff": "2027-12-31",
  "windowCloses": "2028-02-29",
  "outcome": "OTHER",
  "reason": "no-qualifying-attempt",
  "attempts": []
}
